{
  "projectId": "PR-02074",
  "route": "msw",
  "lifecycle": "mock-retired",
  "reconciledAt": "2026-08-31",
  "reconcileNote": "2026-09-02 完成 MSW 退役拆除：后端 4 接口已在 dev 环境验证真实可调，browser.ts 保持 setupWorker() 零 handler，运行时请求直接打真实网关；已删除 prediction handler 及其拦截测试。纯数据 fixture 与 contractTest 保留用于真实 schema/mapper 契约回归，不参与运行时拦截。category/tree 实测顶层 data 为裸数组（非 {categories:[]}），schema=apiCategoryTreeResponseSchema；matchStatus 已按真实契约改由 startTimeUtc0 派生（ASM-008 resolved）。",
  "sourceRoot": "/Users/aven/github/PR-02074",
  "assets": {
    "handler": "apps/web/src/mocks/handlers/prediction.ts",
    "fixture": "apps/web/src/mocks/fixtures/prediction.ts",
    "contractTest": "apps/web/src/mocks/prediction.contract.test.ts",
    "registration": "apps/web/src/mocks/browser.ts",
    "workerHook": "apps/web/src/mocks/useMockWorker.ts",
    "provider": "apps/web/src/app/[lang]/Providers.tsx",
    "handlerExport": "predictionHandlers"
  },
  "endpoints": [
    {
      "id": "tag-events-list",
      "method": "POST",
      "path": "/fe-ex-api/polymarket/getTagEventsList",
      "apiStatus": "dev-ready",
      "filterParams": ["tagTypeTow", "tagTypeThree"],
      "ongoingValue": "in_progress",
      "assumptions": ["ASM-008 (matchStatus not in doc)"],
      "scenarios": [
        { "name": "normal", "status": "implemented", "reason": "" },
        { "name": "empty", "status": "implemented", "reason": "Search and category fixtures cover empty lists" },
        { "name": "business-error", "status": "implemented", "reason": "Invalid tagType returns an error envelope" },
        { "name": "unauthorized", "status": "not-applicable", "reason": "Public market list is readable without authentication" },
        { "name": "pagination-edge", "status": "implemented", "reason": "Fixture is sliced by pageNum and pageSize" }
      ]
    },
    {
      "id": "search-events",
      "method": "POST",
      "path": "/fe-ex-api/polymarket/searchEvents",
      "apiStatus": "dev-ready",
      "responseShape": "{ list, count, currentPage, pageSize }",
      "requestPageField": "currentPage",
      "scenarios": [
        { "name": "normal", "status": "implemented", "reason": "" },
        { "name": "empty", "status": "implemented", "reason": "Empty keyword and unmatched keyword return an empty list" }
      ]
    },
    {
      "id": "category-tree",
      "method": "GET",
      "path": "/fe-ex-api/polymarket/category/tree",
      "apiStatus": "dev-ready",
      "note": "Method changed POST getCategoryTree -> GET category/tree; language via header, appLocale query kept for compat. 2026-08-31 dev 实测：顶层 data 为裸数组，节点 {id,parentId,pathIds,level,code,name,nameMap,sort,children}，Web 用 code 关联。schema=apiCategoryTreeResponseSchema(裸数组，仅建模 code/name/children)，useCategoryTreeQuery 新接线，resolveCategoryChildren 后端优先+静态兜底（dev 仅 sports 有真实数据）",
      "scenarios": [
        { "name": "empty", "status": "implemented", "reason": "Static frontend categories are primary; API fallback returns an empty tree" }
      ]
    },
    {
      "id": "estimated-profit",
      "method": "POST",
      "path": "/fe-ex-api/polymarket/getEstimatedProfit",
      "apiStatus": "dev-ready",
      "note": "2026-08-31 反转：Web端接口文档(1) §4「协议不扩展」+§6 费用明细属后端内部不下发 Web。仅旧字段 estimateProfitAmount/profitAmount/rate/multiplier；8/25 曾加的 9 费用字段已回退，费用拆解 UI 行已删（BLK-001）。注：dev 无真实可交易事件数据，未直接 curl 验证响应体（后端报告已部署），待有种子事件后复核",
      "scenarios": [
        { "name": "buy-success", "status": "implemented", "reason": "" },
        { "name": "sell-success", "status": "implemented", "reason": "" },
        { "name": "validation-error", "status": "not-applicable", "reason": "Doc says invalid input returns a param error code (not data=null); envelope shape not fixtured yet" }
      ]
    }
  ],
  "retirement": {
    "retiredAt": "2026-08-31",
    "retirementCondition": "Backend endpoints confirmed dev-ready (callable), not merely contract-documented",
    "reconciliationEvidence": "product/03-api-contract.md#5-字段对账表mock-阶段就建"
  }
}
